{
  "schemaVersion": 1,
  "hashSpecVersion": 1,
  "createdAt": "2025-12-26T01:16:23Z",
  "frameworkVersion": "1.0.0",
  "moduleId": "AppSCrawler",
  "action": "install",
  "targets": [
    {
      "id": "Google.Chrome",
      "provider": "winget"
    },
    {
      "id": "7zip.7zip",
      "provider": "winget"
    }
  ],
  "policySnapshot": {
    "strictAllowlist": false,
    "requireApproval": false
  },
  "steps": [
    {
      "stepId": "download-1",
      "type": "Download",
      "risk": "Caution",
      "preview": "Download package artifacts (if needed)",
      "timeoutSec": 1800
    },
    {
      "stepId": "install-1",
      "type": "Install",
      "risk": "Caution",
      "preview": "winget install --id \"Google.Chrome\" -e --accept-package-agreements --accept-source-agreements --disable-interactivity",
      "timeoutSec": 1800
    },
    {
      "stepId": "install-2",
      "type": "Install",
      "risk": "Caution",
      "preview": "winget install --id \"7zip.7zip\" -e --accept-package-agreements --accept-source-agreements --disable-interactivity",
      "timeoutSec": 1800
    }
  ],
  "planHash": "200cdc7d2532f5f1283c672d9e03230ae303e20fa33cb77cad0514822a2361ce",
  "signature": null
}
